<?xml version="1.0"?>

<!DOCTYPE Application SYSTEM "file:D:\cvsroot\Current\IntelliSS7\ENGINE\src\engine.dtd">

<!-- Sample XML file for application configuration (INI). -->

<Application name           = "test"
             type           = "console-application"
             globalStart    = "ITU-MTP3"
             binding        = "C">

    <AppOptions name = "traceFlushAfterWrite"         value = "no"/>
    <AppOptions name = "memPoolChecksOn"              value = "no"/>

    <Feature
        name        = "Vendor Framework"
        library     = "libVFrame.so"
        classRec    = "itsSS7STACK_ClassCCITT"
    />

    <Feature
        name        = "IntelliNet stack"
        library     = "libCCITT-VENDOR.so"
        classRec    = "itsINTELLISS7_ClassCCITT"
    />

    <Feature
        name        = "ADAX Vendor lib"
        library     = "libADAXVendor.so"
        classRec    = "itsADAX_ClassCCITT"
    />

    <ToolkitTrace>
        <Critical  output = "stdout"/>
        <Critical  output = "file"/>
        <Error     output = "stdout"/>
        <Error     output = "file"/>
        <Warning   output = "stdout"/>
        <Warning   output = "file"/>
        <Debug     output = "none"/>
    </ToolkitTrace>

    <ApplicationTrace>
        <Critical  output = "file"/>
        <Error     output = "file"/>
        <Warning   output = "file"/>
        <Debug     output = "file"/>
    </ApplicationTrace>

    <ParserExtension    library     = "libADAXVendor.so"
                        elementName = "ADAX_Data"
                        startFunc   = "ADAX_ParseStart"
                        stopFunc    = "ADAX_ParseEnd"
                        xlateFunc   = "ADAX_ConvertParserData"
                        diffFunc    = "ADAX_Diff"
    />

    <ADAX_Data  sectionName = "ADAX SS7-1"
                trunk       = "0"
                TR_TYPE     = "1"
                linkSet     = "1"
                linkCodes   = "0,1,2,3,4,5,6,7,8,9,10,11,12,13,14,15"
    />

    <!--/////////////// LINK SETS //////////////-->
    <!-- link set for internal routing -->
    <LinkSet id           = "0"
             adjacentSTP  = "no"
             numToStart   = "0"
             family       = "ITU">
        <NI     value = "0x80"/>
        <APC    value = "0x0"/>
        <LPC    value = "0x0"/>
    </LinkSet>

    <!-- link set for external routing -->
    <LinkSet id           = "1"
             adjacentSTP  = "no"
             numToStart   = "1"
             family       = "ITU">
        <NI     value = "0x80"/>
        <APC    value = "0x000009"/>
        <LPC    value = "0x000008"/>
    </LinkSet>

    <!-- route for SNMM -->
    <Route  type     = "localRoute"
            style    = "dpc-sio"
            linkSet  = "0"
            priority = "0"
            family   = "ITU">
        <DPC    value = "0x000008"/>
        <SIO    value = "0x80"/>
    </Route>

    <!-- route for SLTM REG -->
    <Route  type     = "localRoute"
            style    = "dpc-sio"
            linkSet  = "0"
            priority = "0"
            family   = "ITU">
        <DPC    value = "0x000008"/>
        <SIO    value = "0x81"/>
    </Route>

    <!-- route for SLTM SPEC -->
    <Route  type     = "localRoute"
            style    = "dpc-sio"
            linkSet  = "0"
            priority = "0"
            family   = "ITU">
        <DPC    value = "0x000008"/>
        <SIO    value = "0x82"/>
    </Route>

    <!-- route for SCCP -->
    <Route  type     = "localRoute"
            style    = "dpc-sio"
            linkSet  = "0"
            priority = "0"
            family   = "ITU">
        <DPC    value = "0x000008"/>
        <SIO    value = "0x83"/>
    </Route>

    <!-- route for TUP -->
    <Route  type     = "localRoute"
            style    = "dpc-sio"
            linkSet  = "0"
            priority = "0"
            family   = "ITU">
        <DPC    value = "0x000008"/>
        <SIO    value = "0x84"/>
    </Route>

    <!-- route for ISUP -->
    <Route  type     = "localRoute"
            style    = "dpc-sio"
            linkSet  = "0"
            priority = "0"
            family   = "ITU">
        <DPC    value = "0x000008"/>
        <SIO    value = "0x85"/>
    </Route>

    <!-- route for DUP (call setup) -->
    <Route  type     = "localRoute"
            style    = "dpc-sio"
            linkSet  = "0"
            priority = "0"
            family   = "ITU">
        <DPC    value = "0x000008"/>
        <SIO    value = "0x86"/>
    </Route>

    <!-- route for DUP (facility) -->
    <Route  type     = "localRoute"
            style    = "dpc-sio"
            linkSet  = "0"
            priority = "0"
            family   = "ITU">
        <DPC    value = "0x000008"/>
        <SIO    value = "0x87"/>
    </Route>

    <!-- route for MTP testing -->
    <Route  type     = "localRoute"
            style    = "dpc-sio"
            linkSet  = "0"
            priority = "0"
            family   = "ITU">
        <DPC    value = "0x000008"/>
        <SIO    value = "0x88"/>
    </Route>

    <!-- route for B-ISUP -->
    <Route  type     = "localRoute"
            style    = "dpc-sio"
            linkSet  = "0"
            priority = "0"
            family   = "ITU">
        <DPC    value = "0x000008"/>
        <SIO    value = "0x89"/>
    </Route>

    <!-- route for S-ISUP -->
    <Route  type     = "localRoute"
            style    = "dpc-sio"
            linkSet  = "0"
            priority = "0"
            family   = "ITU">
        <DPC    value = "0x000008"/>
        <SIO    value = "0x8a"/>
    </Route>

    <!-- route for spare UP -->
    <Route  type     = "localRoute"
            style    = "dpc-sio"
            linkSet  = "0"
            priority = "0"
            family   = "ITU">
        <DPC    value = "0x000008"/>
        <SIO    value = "0x8b"/>
    </Route>

    <!-- route for spare UP -->
    <Route  type     = "localRoute"
            style    = "dpc-sio"
            linkSet  = "0"
            priority = "0"
            family   = "ITU">
        <DPC    value = "0x000008"/>
        <SIO    value = "0x8c"/>
    </Route>

    <!-- route for reserved UP -->
    <Route  type     = "localRoute"
            style    = "dpc-sio"
            linkSet  = "0"
            priority = "0"
            family   = "ITU">
        <DPC    value = "0x000008"/>
        <SIO    value = "0x8d"/>
    </Route>

    <!-- route for reserved UP -->
    <Route  type     = "localRoute"
            style    = "dpc-sio"
            linkSet  = "0"
            priority = "0"
            family   = "ITU">
        <DPC    value = "0x000008"/>
        <SIO    value = "0x8e"/>
    </Route>

    <!-- route for spare UP -->
    <Route  type     = "localRoute"
            style    = "dpc-sio"
            linkSet  = "0"
            priority = "0"
            family   = "ITU">
        <DPC    value = "0x000008"/>
        <SIO    value = "0x8f"/>
    </Route>

    <!-- route for TCAP -->
    <Route  type     = "localRoute"
            style    = "dpc-sio-ssn"
            linkSet  = "0"
            priority = "0"
            family   = "ITU">
        <DPC    value = "0x000008"/>
        <SIO    value = "0x83"/>
        <SSN    value = "5"/>
    </Route>

    <!-- route for adjacent node -->
    <Route  type    = "remoteRoute"
            style   = "dpc-ni"
            linkSet = "1"
            priority = "0"
            family   = "ITU">
        <DPC    value = "0x000009"/>
        <SIO    value = "0x80"/>
    </Route>

    <!-- route for non-adjacent node -->
    <Route  type    = "remoteRoute"
            style   = "dpc-ni"
            linkSet = "1"
            priority = "0"
            family   = "ITU">
        <DPC    value = "0x000000"/>
        <SIO    value = "0x80"/>
    </Route>

    <!--/////////////// DESTINATIONS //////////////-->
    <!-- adjacent destination -->
    <Destination    family      = "ITU"
                    pointCode   = "0x0009"
                    networkInd  = "0x80"
                    mtp3Variant = "WhiteBook_97"
                    isupVariant = "ITU_GENERIC_93"
                    sccpVariant = "WhiteBook_97"
                    tcapVariant = "WhiteBook_97"
                    tupVariant  = "WhiteBook_97"
                    dupVariant  = "WhiteBook_97">

        <ISUPAttributes localPointCode    = "0x0008"
                        sio               = "0x85"
                        classRec          = "isupITU93_Class"
                        library           = "libITU_GENERIC_93.so">

              <!-- Only override timer value -->
              <Timer name       = "T1"
                     value      = "30"
                     handledBy  = "STACK"/>
              />

              <!-- Turn off timer -->
              <Timer name       = "T2"
                     value      = "0"
              />

              <!-- Only override handling -->
              <Timer name       = "T3"
                     handledBy  = "APP"
              />

              <!-- Override both value and handling -->
              <Timer name       = "T4"
                     value      = "30"
                     handledBy  = "APP"
              />

              <!-- Circuit Group #1 -->
              <CircuitGroup huntRule = "DEF">
                  <CircuitCodes start = "1"
                                count = "10"
                  />
                  <CircuitCodes start = "20"
                                count = "10"
                  />
              </CircuitGroup>  

              <!-- Circuit Group #2 -->
              <CircuitGroup huntRule = "ALL">
                  <CircuitCodes  start = "33"/>
              </CircuitGroup>  

              <!-- Circuit Group #3 -->
              <CircuitGroup huntRule = "EVEN">
                  <CircuitCodes start = "65"
                                count = "10"
                  />
                  <CircuitCodes start = "80"
                  />
              </CircuitGroup>